<?xml version="1.0" encoding="UTF-8"?>
<Employees xmlns:xsi="http://www.w3.org/2001/XMLSchema-instance"
	xsi:noNamespaceSchemaLocation="Employee_Info.xsd">
	<Employee>
		<Name>
			<First_name>Raghav</First_name>
			<Last_name>hegde</Last_name>
		</Name>
		<Emp_ID>1338482</Emp_ID>
		<Age>23</Age>
		<Address>
			<Street>Shanavalli</Street>
			<Area>Bedsgoan</Area>
			<City>Mundgod</City>
			<State>Karnataka</State>
			<Pin_Code>581346</Pin_Code>
		</Address>
		<Salary>25000</Salary>
	</Employee>
</Employees>
